{
  "$schema": "https://json-schema.org/draft/2020-12/schema",
  "$id": "https://github.com/dcetlin/Lobster/blob/main/docs/prescription-format.schema.json",
  "title": "WOS Prescription",
  "description": "Formal schema for the 7-section prescription format produced by the Steward and consumed by the Executor in the Lobster Work Orchestration System (WOS) pipeline. Schema version 1.0.0.",
  "type": "object",
  "required": [
    "diagnosis",
    "prescription",
    "workflow",
    "constraints",
    "success_criteria",
    "dan_context",
    "audit_metadata"
  ],
  "additionalProperties": false,
  "properties": {
    "diagnosis": {
      "type": "object",
      "description": "What the Steward observed that prompted this prescription — the upstream signal that triggered the prescribe branch.",
      "required": [
        "signal",
        "reentry_posture",
        "completion_gap",
        "executor_outcome",
        "prior_cycle_count"
      ],
      "additionalProperties": false,
      "properties": {
        "signal": {
          "type": "string",
          "minLength": 1,
          "description": "One-sentence summary of the triggering observation."
        },
        "reentry_posture": {
          "type": "string",
          "enum": [
            "first_execution",
            "executor_orphan",
            "execution_complete",
            "execution_failed",
            "execution_partial",
            "execution_blocked",
            "startup_sweep_possibly_complete",
            "diagnosing_orphan",
            "executing_orphan"
          ],
          "description": "The executor reentry posture assigned by _diagnose_uow()."
        },
        "completion_gap": {
          "type": "string",
          "description": "Human-readable rationale for why the UoW is not yet done. Empty string on first_execution."
        },
        "executor_outcome": {
          "oneOf": [
            {
              "type": "string",
              "enum": ["complete", "partial", "failed", "blocked"]
            },
            {
              "type": "null"
            }
          ],
          "description": "The outcome field from the Executor's result.json if present; null on first execution or when no result file exists."
        },
        "prior_cycle_count": {
          "type": "integer",
          "minimum": 0,
          "description": "steward_cycles value at the time this prescription was produced. Zero on first execution."
        },
        "corrective_intent": {
          "type": "boolean",
          "description": "When true, signals that this prescription is specifically designed to correct a prior failure. Advisory field — the Steward should set this when audit_metadata.executor_posture is 'remediation'. Not enforced by the schema."
        }
      }
    },
    "prescription": {
      "type": "object",
      "description": "The Steward's core recommendation: what to do and why, distilled from the diagnosis.",
      "required": [
        "summary",
        "instructions",
        "estimated_cycles",
        "minimum_viable_output",
        "boundary"
      ],
      "additionalProperties": false,
      "properties": {
        "summary": {
          "type": "string",
          "minLength": 1,
          "maxLength": 500,
          "description": "One-to-two sentence statement of the work to be done in this cycle."
        },
        "instructions": {
          "type": "string",
          "minLength": 1,
          "description": "Complete, actionable natural-language instructions for the Executor."
        },
        "estimated_cycles": {
          "type": "integer",
          "minimum": 1,
          "maximum": 5,
          "description": "Steward estimate of how many Executor passes this prescription requires."
        },
        "minimum_viable_output": {
          "type": "string",
          "minLength": 1,
          "description": "The single concrete deliverable that defines the floor for this cycle."
        },
        "boundary": {
          "type": "string",
          "minLength": 1,
          "description": "The primary scope exclusion the Executor must not cross."
        }
      }
    },
    "workflow": {
      "type": "object",
      "description": "The execution plan: agent type, ordered steps, and optional fan-out for multi-perspective workflows.",
      "required": ["agent_type", "steps"],
      "additionalProperties": false,
      "properties": {
        "agent_type": {
          "type": "string",
          "enum": [
            "functional-engineer",
            "lobster-ops",
            "lobster-generalist",
            "lobster-meta",
            "frontier-writer",
            "design-review"
          ],
          "description": "The Executor dispatch type that will process this prescription."
        },
        "steps": {
          "type": "array",
          "minItems": 1,
          "items": {
            "type": "string",
            "minLength": 1
          },
          "description": "Ordered list of execution steps; each is one imperative sentence."
        },
        "fan_out": {
          "oneOf": [
            {
              "type": "array",
              "items": {
                "type": "object",
                "required": ["agent_type", "focus"],
                "additionalProperties": false,
                "properties": {
                  "agent_type": {
                    "type": "string",
                    "enum": [
                      "functional-engineer",
                      "lobster-ops",
                      "lobster-generalist",
                      "lobster-meta",
                      "frontier-writer",
                      "design-review"
                    ],
                    "description": "Executor type for this parallel branch."
                  },
                  "focus": {
                    "type": "string",
                    "minLength": 1,
                    "description": "One sentence describing what this branch investigates or produces."
                  },
                  "task_id_suffix": {
                    "type": "string",
                    "description": "Optional suffix appended to the UoW task_id for this branch."
                  }
                }
              },
              "description": "Parallel Executor agents for multi-perspective workflows."
            },
            {
              "type": "null"
            }
          ],
          "description": "Fan-out configuration for multi-perspective workflows. Null or absent for single-agent workflows."
        }
      }
    },
    "constraints": {
      "type": "object",
      "description": "Hard limits the Executor must not violate: scope exclusions, protected files, and authority boundaries.",
      "required": ["boundary"],
      "additionalProperties": false,
      "properties": {
        "boundary": {
          "type": "string",
          "minLength": 1,
          "description": "Primary scope exclusion. Authoritative location for all 'do not' rules."
        },
        "no_modify": {
          "type": "array",
          "items": {
            "type": "string",
            "minLength": 1
          },
          "description": "Files, modules, tables, or systems the Executor must not touch."
        },
        "no_deploy": {
          "type": "boolean",
          "description": "If true, the Executor must not push to remote, merge PRs, or modify production infrastructure. Defaults to false."
        },
        "max_cycles": {
          "type": "integer",
          "minimum": 1,
          "maximum": 10,
          "description": "Override for maximum Executor passes before the Steward surfaces to Dan."
        }
      }
    },
    "success_criteria": {
      "type": "object",
      "description": "Verifiable conditions the Steward evaluates to determine whether the UoW is done.",
      "required": ["check"],
      "additionalProperties": false,
      "properties": {
        "check": {
          "type": "string",
          "minLength": 1,
          "description": "Human-readable description of the verification method."
        },
        "artifacts": {
          "type": "array",
          "items": {
            "type": "string",
            "minLength": 1
          },
          "description": "Absolute paths or glob patterns of files that must exist and be non-empty after execution."
        },
        "commands": {
          "type": "array",
          "items": {
            "type": "string",
            "minLength": 1
          },
          "description": "Shell commands the Steward or reviewer may run to verify completion."
        },
        "gate_command": {
          "oneOf": [
            {
              "type": "string",
              "minLength": 1
            },
            {
              "type": "null"
            }
          ],
          "description": "For iterative-convergent register UoWs: the canonical gate command whose score the Executor reports in trace.json. Null for all other registers."
        }
      }
    },
    "dan_context": {
      "type": "object",
      "description": "Human-facing context orienting the user to this UoW within its broader initiative. All fields are freeform prose.",
      "required": [],
      "additionalProperties": false,
      "properties": {
        "orientation": {
          "type": "string",
          "description": "One or two sentences placing this UoW in its broader initiative context."
        },
        "priority_signal": {
          "type": "string",
          "description": "Why this UoW matters now — the urgency or dependency signal."
        },
        "open_questions": {
          "type": "array",
          "items": {
            "type": "string"
          },
          "description": "Questions the Executor cannot resolve that may require Dan's input."
        },
        "load_bearing_assumption": {
          "type": "string",
          "description": "The single most important assumption this prescription rests on."
        }
      }
    },
    "audit_metadata": {
      "type": "object",
      "description": "Machine-readable tracking fields correlating this prescription with its UoW, cycle history, and schema version.",
      "required": [
        "uow_id",
        "cycle",
        "executor_posture",
        "schema_version",
        "prescribed_at"
      ],
      "additionalProperties": false,
      "properties": {
        "uow_id": {
          "type": "string",
          "pattern": "^uow_\\d{8}_[a-f0-9]{6}$",
          "description": "The UoW ID this prescription belongs to. Must match the UoW record's id field."
        },
        "cycle": {
          "type": "integer",
          "minimum": 0,
          "description": "Steward cycle number at prescription time. Zero-indexed; must equal diagnosis.prior_cycle_count."
        },
        "executor_posture": {
          "type": "string",
          "enum": ["first_execution", "continuation", "remediation"],
          "description": "The execution posture this prescription targets, derived from reentry classification."
        },
        "schema_version": {
          "type": "string",
          "pattern": "^\\d+\\.\\d+\\.\\d+$",
          "description": "Semver string identifying the prescription format version. Current: 1.0.0."
        },
        "prescribed_at": {
          "type": "string",
          "format": "date-time",
          "description": "ISO-8601 UTC timestamp of when this prescription was produced."
        },
        "prescribed_skills": {
          "type": "array",
          "items": {
            "type": "string",
            "minLength": 1
          },
          "description": "Skill identifiers to activate before dispatching the Executor."
        }
      }
    }
  }
}
